{
  "$schema": "https://json-schema.org/draft/2020-12/schema",
  "$id": "tfg/requirements_v2.schema.json",
  "title": "Catálogo de requisitos EARS/MASTeR v2 (fase 2, un lote, salida de Modelo A / Modelo B)",
  "$comment": "Los ids de requisitos y preguntas son cadenas libres: el normalizador los renumera por tipo. Los CAP- (inventario) y QI- (preguntas del inventario) son fijos. Los criterios sin etiqueta (C19), los requisitos sin capability_ids del lote (C21), los fragmentos del lote sin citar (C23) y los tipos que no admite el kind de su funcionalidad (C24) son avisos, no errores de esquema.",
  "type": "object",
  "additionalProperties": false,
  "required": ["schema_version", "system", "language", "capability_objections", "requirements",
               "open_questions", "domain_terms", "verdict"],
  "properties": {
    "schema_version": { "const": "2.0" },
    "system": { "type": "string", "minLength": 1 },
    "language": { "enum": ["es", "en"] },
    "capability_objections": { "type": "array", "items": { "$ref": "#/$defs/capability_objection" } },
    "requirements": { "type": "array", "items": { "$ref": "#/$defs/requirement" } },
    "open_questions": { "type": "array", "items": { "$ref": "#/$defs/open_question" } },
    "domain_terms": { "type": "array", "items": { "$ref": "#/$defs/domain_term" } },
    "verdict": { "$ref": "#/$defs/verdict" }
  },
  "$defs": {
    "nullable_string": { "type": ["string", "null"], "minLength": 1 },
    "id": { "type": "string", "minLength": 1 },
    "fragment_id": { "type": "string", "pattern": "^(DOC-[A-Za-z0-9_-]+#F[0-9]{3,}|DUDAS#[A-Za-z0-9_-]+)$" },
    "trace": {
      "type": "object",
      "additionalProperties": false,
      "required": ["fragment", "quote"],
      "properties": {
        "fragment": { "$ref": "#/$defs/fragment_id" },
        "quote": { "type": "string", "minLength": 1, "maxLength": 300 }
      }
    },
    "capability_objection": {
      "type": "object",
      "additionalProperties": false,
      "required": ["capability_id", "reason", "duplicate_of", "note"],
      "properties": {
        "capability_id": { "$ref": "#/$defs/id" },
        "reason": { "enum": ["duplicate", "not_a_requirement", "future"] },
        "duplicate_of": { "$ref": "#/$defs/nullable_string" },
        "note": { "type": "string", "minLength": 1, "maxLength": 300 }
      },
      "if": { "properties": { "reason": { "const": "duplicate" } } },
      "then": { "properties": { "duplicate_of": { "type": "string", "minLength": 1 } } },
      "else": { "properties": { "duplicate_of": { "const": null } } }
    },
    "slots_ears": {
      "type": "object",
      "additionalProperties": false,
      "required": ["system", "feature", "states", "trigger", "trigger_keyword", "response"],
      "properties": {
        "system": { "type": "string", "minLength": 1 },
        "feature": { "$ref": "#/$defs/nullable_string" },
        "states": { "type": "array", "items": { "type": "string", "minLength": 1 } },
        "trigger": { "$ref": "#/$defs/nullable_string" },
        "trigger_keyword": { "enum": ["WHEN", "IF", null] },
        "response": { "type": "string", "minLength": 1 }
      }
    },
    "slots_master_functional": {
      "type": "object",
      "additionalProperties": false,
      "required": ["system", "condition", "actor", "process_verb", "object", "details"],
      "properties": {
        "system": { "type": "string", "minLength": 1 },
        "condition": { "$ref": "#/$defs/nullable_string" },
        "actor": { "$ref": "#/$defs/nullable_string" },
        "process_verb": { "type": "string", "minLength": 1 },
        "object": { "type": "string", "minLength": 1 },
        "details": { "$ref": "#/$defs/nullable_string" }
      }
    },
    "slots_master_property": {
      "type": "object",
      "additionalProperties": false,
      "required": ["condition", "characteristic", "subject_matter", "qualifying_expression", "value"],
      "properties": {
        "condition": { "$ref": "#/$defs/nullable_string" },
        "characteristic": { "type": "string", "minLength": 1 },
        "subject_matter": { "type": "string", "minLength": 1 },
        "qualifying_expression": { "$ref": "#/$defs/nullable_string" },
        "value": { "type": "string", "minLength": 1 }
      }
    },
    "requirement": {
      "type": "object",
      "additionalProperties": false,
      "required": ["id", "type", "capability_ids", "source_trace", "obligation", "obligation_basis",
                   "obligation_evidence", "decision_branch", "notation", "ears_pattern", "master_template",
                   "master_activity", "master_condition", "escalation_fallback", "slots", "acceptance_criteria",
                   "origin", "derived_from", "open_question_ids"],
      "properties": {
        "id": { "$ref": "#/$defs/id" },
        "type": { "enum": ["RF", "RI", "RNF", "RA", "RT"] },
        "capability_ids": { "type": "array", "items": { "$ref": "#/$defs/id" } },
        "source_trace": { "type": "array", "minItems": 1, "items": { "$ref": "#/$defs/trace" } },
        "obligation": { "enum": ["SHALL", "SHOULD", "MAY"] },
        "obligation_basis": { "enum": ["explicit", "implicit"] },
        "obligation_evidence": { "$ref": "#/$defs/nullable_string" },
        "decision_branch": { "enum": ["D1", "D2", "D3", "D4", "D5"] },
        "notation": { "enum": ["EARS", "MASTeR"] },
        "ears_pattern": { "enum": ["ubiquitous", "event_driven", "state_driven", "unwanted_behaviour",
                                   "optional_feature", "complex", null] },
        "master_template": { "enum": ["functional", "property", null] },
        "master_activity": { "enum": ["autonomous", "user_interaction", "interface", null] },
        "master_condition": { "enum": ["none", "logic", "event", "time", null] },
        "escalation_fallback": { "$ref": "#/$defs/nullable_string" },
        "slots": { "type": "object" },
        "acceptance_criteria": { "type": "array", "items": { "type": "string", "minLength": 1 } },
        "origin": { "enum": ["explicit", "clarification", "derived"] },
        "derived_from": { "type": "array", "items": { "$ref": "#/$defs/id" } },
        "open_question_ids": { "type": "array", "items": { "$ref": "#/$defs/id" } }
      },
      "allOf": [
        {
          "if": { "properties": { "notation": { "const": "EARS" } } },
          "then": {
            "properties": {
              "ears_pattern": { "not": { "const": null } },
              "master_template": { "const": null },
              "master_activity": { "const": null },
              "master_condition": { "const": null },
              "obligation": { "const": "SHALL" },
              "slots": { "$ref": "#/$defs/slots_ears" }
            }
          }
        },
        {
          "if": { "properties": { "notation": { "const": "MASTeR" } } },
          "then": {
            "properties": {
              "ears_pattern": { "const": null },
              "master_template": { "not": { "const": null } },
              "master_condition": { "not": { "const": null } },
              "escalation_fallback": { "const": null }
            }
          }
        },
        {
          "if": { "properties": { "notation": { "const": "MASTeR" }, "master_template": { "const": "functional" } } },
          "then": {
            "properties": {
              "master_activity": { "not": { "const": null } },
              "slots": { "$ref": "#/$defs/slots_master_functional" }
            }
          }
        },
        {
          "if": { "properties": { "notation": { "const": "MASTeR" }, "master_template": { "const": "property" } } },
          "then": {
            "properties": {
              "master_activity": { "const": null },
              "slots": { "$ref": "#/$defs/slots_master_property" }
            }
          }
        },
        {
          "if": { "properties": { "obligation_basis": { "const": "explicit" } } },
          "then": { "properties": { "obligation_evidence": { "type": "string", "minLength": 1 } } },
          "else": { "properties": { "obligation_evidence": { "const": null }, "obligation": { "const": "SHALL" } } }
        },
        {
          "if": { "properties": { "origin": { "const": "derived" } } },
          "then": { "properties": { "derived_from": { "minItems": 1 } } }
        }
      ]
    },
    "open_question": {
      "type": "object",
      "additionalProperties": false,
      "required": ["id", "type", "question", "related_requirements", "source_trace"],
      "properties": {
        "id": { "$ref": "#/$defs/id" },
        "type": { "enum": ["contradiction", "scope", "missing_value", "ambiguity", "missing_actor"] },
        "question": { "type": "string", "minLength": 1 },
        "related_requirements": { "type": "array", "items": { "$ref": "#/$defs/id" } },
        "source_trace": { "type": "array", "minItems": 1, "items": { "$ref": "#/$defs/trace" } }
      }
    },
    "domain_term": {
      "type": "object",
      "additionalProperties": false,
      "required": ["term", "fragment"],
      "properties": {
        "term": { "type": "string", "minLength": 3 },
        "fragment": { "$ref": "#/$defs/fragment_id" }
      }
    },
    "verdict": {
      "type": "object",
      "additionalProperties": false,
      "required": ["status", "issues", "uncovered_capabilities"],
      "properties": {
        "status": { "enum": ["complete", "partial", "failed"] },
        "issues": { "type": "array", "items": { "type": "string" } },
        "uncovered_capabilities": { "type": "array", "items": { "$ref": "#/$defs/id" } }
      }
    }
  }
}
