{
  "schema_version": "2.0",
  "system": "the LibraryLoan system",
  "language": "en",
  "capability_objections": [],
  "requirements": [
    {
      "id": "RF-001",
      "type": "RF",
      "capability_ids": [
        "CAP-001"
      ],
      "source_trace": [
        {
          "fragment": "DOC-01#F004",
          "quote": "A member can reserve a book that is on loan"
        }
      ],
      "obligation": "SHALL",
      "obligation_basis": "implicit",
      "obligation_evidence": null,
      "decision_branch": "D5",
      "notation": "EARS",
      "ears_pattern": "ubiquitous",
      "master_template": null,
      "master_activity": null,
      "master_condition": null,
      "escalation_fallback": null,
      "slots": {
        "system": "the LibraryLoan system",
        "feature": null,
        "states": [],
        "trigger": null,
        "trigger_keyword": null,
        "response": "allow a member to reserve a book that is on loan"
      },
      "acceptance_criteria": [],
      "origin": "explicit",
      "derived_from": [],
      "open_question_ids": []
    },
    {
      "id": "RF-002",
      "type": "RF",
      "capability_ids": [
        "CAP-002"
      ],
      "source_trace": [
        {
          "fragment": "DOC-01#F005",
          "quote": "When a member returns a book, the system will update the loan record"
        },
        {
          "fragment": "DOC-01#F006",
          "quote": "If the barcode of a book cannot be read, the system shall display an error message to the librarian"
        }
      ],
      "obligation": "SHALL",
      "obligation_basis": "implicit",
      "obligation_evidence": null,
      "decision_branch": "D5",
      "notation": "EARS",
      "ears_pattern": "event_driven",
      "master_template": null,
      "master_activity": null,
      "master_condition": null,
      "escalation_fallback": null,
      "slots": {
        "system": "the LibraryLoan system",
        "feature": null,
        "states": [],
        "trigger": "a member returns a book",
        "trigger_keyword": "WHEN",
        "response": "update the loan record"
      },
      "acceptance_criteria": [
        "[ERROR] If the barcode of a book cannot be read, the system displays an error message to the librarian."
      ],
      "origin": "explicit",
      "derived_from": [],
      "open_question_ids": []
    },
    {
      "id": "RF-003",
      "type": "RF",
      "capability_ids": [
        "CAP-003"
      ],
      "source_trace": [
        {
          "fragment": "DOC-01#F007",
          "quote": "The librarian shall be able to:"
        },
        {
          "fragment": "DOC-01#F008",
          "quote": "register new members,"
        },
        {
          "fragment": "DOC-01#F009",
          "quote": "deactivate members."
        }
      ],
      "obligation": "SHALL",
      "obligation_basis": "explicit",
      "obligation_evidence": "shall",
      "decision_branch": "D5",
      "notation": "EARS",
      "ears_pattern": "ubiquitous",
      "master_template": null,
      "master_activity": null,
      "master_condition": null,
      "escalation_fallback": null,
      "slots": {
        "system": "the LibraryLoan system",
        "feature": null,
        "states": [],
        "trigger": null,
        "trigger_keyword": null,
        "response": "allow the librarian to register new members and deactivate members"
      },
      "acceptance_criteria": [],
      "origin": "explicit",
      "derived_from": [],
      "open_question_ids": []
    },
    {
      "id": "RF-004",
      "type": "RF",
      "capability_ids": [
        "CAP-004"
      ],
      "source_trace": [
        {
          "fragment": "DOC-01#F010",
          "quote": "The system may send reminder emails before the due date"
        }
      ],
      "obligation": "MAY",
      "obligation_basis": "explicit",
      "obligation_evidence": "may",
      "decision_branch": "D3",
      "notation": "MASTeR",
      "ears_pattern": null,
      "master_template": "functional",
      "master_activity": "autonomous",
      "master_condition": "none",
      "escalation_fallback": null,
      "slots": {
        "system": "the LibraryLoan system",
        "condition": null,
        "actor": null,
        "process_verb": "send",
        "object": "reminder emails",
        "details": "before the due date"
      },
      "acceptance_criteria": [],
      "origin": "explicit",
      "derived_from": [],
      "open_question_ids": []
    },
    {
      "id": "RF-005",
      "type": "RF",
      "capability_ids": [
        "CAP-005"
      ],
      "source_trace": [
        {
          "fragment": "DOC-01#F011",
          "quote": "Members can subscribe to the Flexible Loan plan"
        }
      ],
      "obligation": "SHALL",
      "obligation_basis": "implicit",
      "obligation_evidence": null,
      "decision_branch": "D5",
      "notation": "EARS",
      "ears_pattern": "ubiquitous",
      "master_template": null,
      "master_activity": null,
      "master_condition": null,
      "escalation_fallback": null,
      "slots": {
        "system": "the LibraryLoan system",
        "feature": null,
        "states": [],
        "trigger": null,
        "trigger_keyword": null,
        "response": "allow members to subscribe to the Flexible Loan plan"
      },
      "acceptance_criteria": [],
      "origin": "explicit",
      "derived_from": [],
      "open_question_ids": []
    },
    {
      "id": "RNF-001",
      "type": "RNF",
      "capability_ids": [
        "CAP-006"
      ],
      "source_trace": [
        {
          "fragment": "DOC-01#F013",
          "quote": "The response time of the search function shall be less than 2 seconds"
        }
      ],
      "obligation": "SHALL",
      "obligation_basis": "explicit",
      "obligation_evidence": "shall",
      "decision_branch": "D1",
      "notation": "MASTeR",
      "ears_pattern": null,
      "master_template": "property",
      "master_activity": null,
      "master_condition": "none",
      "escalation_fallback": null,
      "slots": {
        "condition": null,
        "characteristic": "the response time",
        "subject_matter": "of the search function",
        "qualifying_expression": "less than",
        "value": "2 seconds"
      },
      "acceptance_criteria": [],
      "origin": "explicit",
      "derived_from": [],
      "open_question_ids": []
    }
  ],
  "open_questions": [],
  "domain_terms": [
    {
      "term": "Flexible",
      "fragment": "DOC-01#F011"
    }
  ],
  "verdict": {
    "status": "complete",
    "issues": [],
    "uncovered_capabilities": []
  }
}
